{
  "abstentions": [
    {
      "clause_type": "notices",
      "reason": "The signature block containing the notice email addresses is not included in the provided text, so the validity, ownership, and adequacy of the notice addresses cannot be assessed."
    },
    {
      "clause_type": "signature_and_execution",
      "reason": "No execution page, signatory names, titles, or effective date are present in the supplied document; authority to bind and commencement date cannot be reviewed."
    },
    {
      "clause_type": "purpose_and_permitted_use",
      "reason": "The Agreement does not state a defined Purpose or any underlying transaction document; without that context the permitted scope of use of Confidential Information cannot be evaluated."
    },
    {
      "clause_type": "governing_law",
      "reason": "No jurisdiction/venue provision or referenced dispute schedule is included, so the complete dispute-resolution position cannot be concluded."
    }
  ],
  "citations": [
    {
      "clause_type": "definition_of_confidential_information",
      "quote": "whether oral, written, or electronic, whether or not marked as"
    },
    {
      "clause_type": "confidentiality_obligation",
      "quote": "The Receiving Party shall keep all Confidential Information secret and shall not"
    },
    {
      "clause_type": "term_and_duration",
      "quote": "remain in effect in perpetuity."
    },
    {
      "clause_type": "return_or_destruction",
      "quote": "Confidential Information in its possession within thirty (30) days."
    },
    {
      "clause_type": "governing_law",
      "quote": "the Federal Republic of Germany."
    },
    {
      "clause_type": "permitted_disclosures",
      "quote": "the Receiving Party first obtains the prior written consent of the Disclosing"
    },
    {
      "clause_type": "residual_knowledge",
      "quote": "including for the benefit of third parties."
    },
    {
      "clause_type": "no_license",
      "quote": "Nothing in this Agreement grants the Receiving Party any licence or other right in"
    },
    {
      "clause_type": "injunctive_relief",
      "quote": "the Disclosing Party may seek injunctive relief in addition to any other"
    },
    {
      "clause_type": "assignment",
      "quote": "The Receiving Party may assign this Agreement, in whole or in part, to any third"
    },
    {
      "clause_type": "notices",
      "quote": "Notices under this Agreement are effective when sent by email to the address"
    },
    {
      "clause_type": "mutuality_of_obligations",
      "quote": "Northwind Materials GmbH (\"Disclosing Party\") and Cverbio Labs Inc."
    }
  ],
  "clauses": [
    {
      "clause_type": "definition_of_confidential_information",
      "text": "Section 1 defines Confidential Information as all information disclosed in any form, marked or unmarked, with no stated exclusions (e.g., public domain, independently developed, lawfully received)."
    },
    {
      "clause_type": "confidentiality_obligation",
      "text": "Section 2 requires the Receiving Party to keep all Confidential Information secret and not disclose it to third parties without prior written consent."
    },
    {
      "clause_type": "term_and_duration",
      "text": "Section 3 states confidentiality obligations continue in perpetuity with no fixed expiry."
    },
    {
      "clause_type": "return_or_destruction",
      "text": "Section 4 requires return or destruction of Confidential Information within 30 days of written request."
    },
    {
      "clause_type": "governing_law",
      "text": "Section 5 selects the laws of the Federal Republic of Germany; no forum/jurisdiction clause is included."
    },
    {
      "clause_type": "permitted_disclosures",
      "text": "Section 6 permits legally compelled disclosure but conditions it on first obtaining the Disclosing Party's prior written consent."
    },
    {
      "clause_type": "residual_knowledge",
      "text": "Section 7 allows use of unaided-memory know-how, expressly including for the benefit of third parties."
    },
    {
      "clause_type": "no_license",
      "text": "Section 8 confirms no licence or other IP right is granted to the Receiving Party."
    },
    {
      "clause_type": "injunctive_relief",
      "text": "Section 9 acknowledges damages may be inadequate and permits the Disclosing Party to seek injunctive relief."
    },
    {
      "clause_type": "assignment",
      "text": "Section 10 permits the Receiving Party to assign the Agreement freely, including to a competitor, without consent."
    },
    {
      "clause_type": "notices",
      "text": "Section 11 makes email notices effective on sending, to addresses in the signature block."
    },
    {
      "clause_type": "mutuality_of_obligations",
      "text": "Titled a mutual NDA, but roles are fixed as a single Disclosing Party and single Receiving Party throughout."
    }
  ],
  "risk_flags": [
    {
      "clause_type": "permitted_disclosures",
      "rationale": "Conditioning legally required disclosure on the Disclosing Party's prior written consent is impracticable and may be unenforceable; it can place the Receiving Party in conflict with a court order or regulator. Standard practice is notice (where lawful) and cooperation, not consent.",
      "severity": "high"
    },
    {
      "clause_type": "residual_knowledge",
      "rationale": "A broad residuals carve-out that expressly permits use 'for the benefit of third parties' can effectively gut the confidentiality obligation, allowing personnel to exploit remembered know-how for competitors.",
      "severity": "high"
    },
    {
      "clause_type": "assignment",
      "rationale": "Unrestricted assignment by the Receiving Party, expressly including to a competitor and without consent, allows Confidential Information obligations (and access) to transfer to an adverse party.",
      "severity": "high"
    },
    {
      "clause_type": "term_and_duration",
      "rationale": "Perpetual confidentiality with no exclusions or trade-secret/non-trade-secret distinction may be unenforceable or excessively burdensome in some jurisdictions, and creates indefinite compliance costs.",
      "severity": "medium"
    },
    {
      "clause_type": "definition_of_confidential_information",
      "rationale": "No standard exclusions (public domain, prior possession, independent development, lawful third-party receipt) and no marking requirement, making the scope unbounded and hard to administer.",
      "severity": "medium"
    },
    {
      "clause_type": "mutuality_of_obligations",
      "rationale": "The Agreement is labelled mutual but assigns fixed Disclosing/Receiving roles, so obligations may operate one-way contrary to the stated intent.",
      "severity": "medium"
    },
    {
      "clause_type": "notices",
      "rationale": "Email notices effective on sending (not receipt), with no confirmation mechanism, create dispute risk over whether notice was validly given.",
      "severity": "low"
    },
    {
      "clause_type": "return_or_destruction",
      "rationale": "No carve-out for archival/backup copies or legally mandated retention, and no certification of destruction requirement.",
      "severity": "low"
    },
    {
      "clause_type": "governing_law",
      "rationale": "Governing law is specified but no exclusive jurisdiction or venue is designated, which may lead to forum disputes, particularly given a US-incorporated counterparty.",
      "severity": "low"
    }
  ]
}
