{
  "abstentions": [
    {
      "clause_type": "sub_processors",
      "reason": "The sub-processor list is referenced as published on the Provider's website but is not attached or reproduced; the identities, locations, and transfer mechanisms of sub-processors cannot be reviewed."
    },
    {
      "clause_type": "data_protection",
      "reason": "No Data Processing Addendum, Annex, or standard contractual clauses are attached; Art. 28 detail (processing purposes, categories of data, international transfer safeguards, audit rights, breach notification) cannot be assessed."
    },
    {
      "clause_type": "service_level",
      "reason": "No SLA schedule or service-credit exhibit is included; downtime measurement method, exclusions, and remedies for missing 99.5% are indeterminate."
    },
    {
      "clause_type": "fees",
      "reason": "No pricing schedule or order form is provided, so the baseline fees, payment terms, and the practical magnitude of the increase right cannot be evaluated."
    },
    {
      "clause_type": "security",
      "reason": "No security schedule, control list, or certification evidence is attached, so 'industry standard' cannot be benchmarked."
    },
    {
      "clause_type": "governing_law_and_dispute_resolution",
      "reason": "The document contains no governing law, jurisdiction, or dispute-resolution provision; enforceability of the liability cap, indemnity, and data licence cannot be assessed without it."
    },
    {
      "clause_type": "termination_for_cause",
      "reason": "No termination-for-breach, suspension, or effect-of-termination provision (other than data deletion) appears in the excerpt provided."
    },
    {
      "clause_type": "confidentiality",
      "reason": "No confidentiality clause is present in the document supplied; unable to determine how Customer Data is protected outside the data protection section."
    }
  ],
  "citations": [
    {
      "clause_type": "service_level",
      "quote": "The Provider shall use commercially reasonable efforts to maintain 99.5% monthly\nuptime, measured over each calendar month."
    },
    {
      "clause_type": "data_protection",
      "quote": "The Provider shall process Customer Personal Data only on documented instructions\nfrom the Customer, in accordance with applicable data protection law."
    },
    {
      "clause_type": "limitation_of_liability",
      "quote": "The Provider's total liability under this Agreement shall not exceed the fees paid\nin the twelve (12) months preceding the claim."
    },
    {
      "clause_type": "term",
      "quote": "The initial term of this Agreement is twelve (12) months from the effective date."
    },
    {
      "clause_type": "auto_renewal",
      "quote": "This Agreement renews automatically for successive twelve (12) month terms unless\neither party gives ninety (90) days written notice prior to the end of the\nthen-current term."
    },
    {
      "clause_type": "sub_processors",
      "quote": "The Provider may appoint sub-processors to process Customer Personal Data and\nshall publish an updated list on its website. No notice to the Customer is\nrequired."
    },
    {
      "clause_type": "security",
      "quote": "The Provider shall maintain industry standard security measures appropriate to a\nprovider of its size."
    },
    {
      "clause_type": "intellectual_property_data_license",
      "quote": "The Customer grants the Provider a perpetual, irrevocable, worldwide licence to\nuse Customer Data, including Customer Personal Data, to develop and train the\nProvider's machine learning models and to create derivative products."
    },
    {
      "clause_type": "indemnity",
      "quote": "The Customer shall indemnify and hold harmless the Provider against all claims\narising from the use of the service, including claims that the service infringes\nthe intellectual property rights of a third party."
    },
    {
      "clause_type": "fees",
      "quote": "The Provider may increase the fees at any time on thirty (30) days written notice.\nThe Customer has no right to terminate on account of a fee increase."
    },
    {
      "clause_type": "data_export_and_deletion",
      "quote": "The Provider shall delete all Customer Data seven (7) days after termination. The\nCustomer may request an export within that period."
    }
  ],
  "clauses": [
    {
      "clause_type": "service_level",
      "text": "Commercially reasonable efforts to maintain 99.5% monthly uptime, measured per calendar month."
    },
    {
      "clause_type": "data_protection",
      "text": "Provider processes Customer Personal Data only on documented Customer instructions, per applicable data protection law."
    },
    {
      "clause_type": "limitation_of_liability",
      "text": "Provider's aggregate liability capped at fees paid in the 12 months preceding the claim."
    },
    {
      "clause_type": "term",
      "text": "Initial term of twelve (12) months from the effective date."
    },
    {
      "clause_type": "auto_renewal",
      "text": "Automatic renewal for successive 12-month terms unless 90 days' prior written notice is given."
    },
    {
      "clause_type": "sub_processors",
      "text": "Provider may appoint sub-processors and publish an updated list online; no notice to Customer required."
    },
    {
      "clause_type": "security",
      "text": "Provider maintains 'industry standard' security measures appropriate to a provider of its size."
    },
    {
      "clause_type": "intellectual_property_data_license",
      "text": "Customer grants Provider a perpetual, irrevocable, worldwide licence to use Customer Data, including Personal Data, for ML model training and derivative products."
    },
    {
      "clause_type": "indemnity",
      "text": "Customer indemnifies Provider for all claims arising from use of the service, including third-party IP infringement claims."
    },
    {
      "clause_type": "fees",
      "text": "Provider may raise fees at any time on 30 days' notice; Customer has no termination right for price increases."
    },
    {
      "clause_type": "data_export_and_deletion",
      "text": "Provider deletes all Customer Data 7 days after termination; Customer may request export within that window."
    }
  ],
  "risk_flags": [
    {
      "clause_type": "intellectual_property_data_license",
      "rationale": "Perpetual, irrevocable licence to use Customer Personal Data for ML training conflicts with the Section 2 'documented instructions' processor role and is very difficult to reconcile with GDPR lawful-basis, purpose-limitation and erasure obligations for a German customer.",
      "severity": "high"
    },
    {
      "clause_type": "indemnity",
      "rationale": "One-way indemnity requiring the Customer to cover third-party IP infringement claims about the Provider's own service is a reverse allocation of risk; normally the Provider indemnifies for IP infringement.",
      "severity": "high"
    },
    {
      "clause_type": "sub_processors",
      "rationale": "No notice and no objection right for new sub-processors falls short of the customary GDPR Art. 28(2)/(4) requirement for prior information and an opportunity to object.",
      "severity": "high"
    },
    {
      "clause_type": "data_export_and_deletion",
      "rationale": "A 7-day post-termination deletion window with export only on request risks irrecoverable data loss; no defined export format, SLA, or assistance obligation.",
      "severity": "high"
    },
    {
      "clause_type": "fees",
      "rationale": "Unlimited fee increases on 30 days' notice with no cap and no corresponding termination right leaves the Customer economically exposed during the term.",
      "severity": "medium"
    },
    {
      "clause_type": "auto_renewal",
      "rationale": "90-day notice window before a 12-month auto-renewal is long; missing the window locks in another full year, compounded by the uncapped fee-increase right.",
      "severity": "medium"
    },
    {
      "clause_type": "limitation_of_liability",
      "rationale": "12-month fee cap appears to apply to all liability with no stated carve-outs for data breach, confidentiality, IP indemnity, or wilful misconduct; also appears one-sided in the Provider's favour.",
      "severity": "medium"
    },
    {
      "clause_type": "service_level",
      "rationale": "'Commercially reasonable efforts' toward 99.5% uptime creates no firm commitment, and no service credits, measurement methodology, or exclusions are stated in the document.",
      "severity": "medium"
    },
    {
      "clause_type": "security",
      "rationale": "'Industry standard ... appropriate to a provider of its size' is subjective and unmeasurable; no specific controls, certifications (e.g. ISO 27001, SOC 2), audit rights, or breach-notification timeline are set out.",
      "severity": "medium"
    }
  ]
}
